<!ELEMENT EmployeeInfo (Employee)*>
<!ELEMENT Employee (Name, Department, Telephone, Email)>
<!ELEMENT Name (#PCDATA)>
<!ELEMENT Department (#PCDATA)>
<!ELEMENT Telephone (#PCDATA)>
<!ELEMENT Email (#PCDATA)>
<!ATTLIST Employee EmployeeNumber CDATA #REQUIRED>