<?xml version="1.0" encoding="UTF-8"?><!-- THIs Is AN XML COMMENT -->
<!DOCTYPE EmployeeInfo SYSTEM "simple.dtd">
<EmployeeInfo xmlns:xsi="http://www.w3.org/2001/XMLSchema-instance"  xmlns:e="http://www.sample.com/EmployeeInfo"           xsi:schemaLocation="http://www.sample.com/EmployeeInfo simple.xsd"><!-- THIs Is AN XML COMMENT -->
    <Employee EmployeeNumber="1"> <!-- THIs Is AN XML COMMENT -->
        <Name>Masashi Okamura</Name>
        <Department>Design Department</Department>
        <Telephone>03-1452-4567</Telephone>
        <Email>okamura@xmltr.co.jp<!-- THIs Is AN XML COMMENT --></Email>
        <Email>okamura@xmltr.co.jp<!-- THIs Is AN XML COMMENT --></Email>
        <XXX>
            <ABC>03-1452-4567</ABC>
        </XXX>
    </Employee>
    <Employee EmployeeNumber="2">
        <Name>Aiko Tanaka</Name>
        <Department>Sales Department</Department>
        <Telephone>03-6459-98764</Telephone>
        <Email>tanaka@xmltr.co.jp</Email>
    </Employee>
</EmployeeInfo>
